{
  "slug": "riad-marrakech-royal",
  "name": "Riad Marrakech Royal",
  "accommodation_type": "guesthouse",
  "country_slug": "morocco",
  "destination_slug": "marrakech",
  "operator_slug": "atlas-nomad-tours",
  "summary": "Luxury riad in the heart of the medina with rooftop terrace.",
  "description": "Traditional Moroccan architecture, plunge pool, and authentic cuisine.",
  "location_label": "Medina, Marrakech",
  "address_line_1": "Derb Dabachi, 40000 Marrakech",
  "latitude": 31.6295,
  "longitude": -7.9811,
  "hero_image_url": "https://images.unsplash.com/photo-1597211686415-8006c6e3b818?w=1600",
  "amenities": ["Pool", "Rooftop terrace", "Hammam", "Free Wi-Fi"],
  "room_types": ["Double", "Suite"],
  "board_basis": ["Bed & Breakfast", "Half Board"],
  "check_in_time": "14:00",
  "check_out_time": "11:00",
  "child_policy": "Children welcome",
  "cancellation_policy": "Free cancellation 7 days before",
  "payment_policy": "Credit card guarantee",
  "verified_status": "verified",
  "review_count": 112,
  "average_rating": 4.6,
  "response_time_hours": 2,
  "is_featured": true,
  "is_published": true,
  "units": [
    {
      "unit_name": "Standard Double Room",
      "unit_type": "double",
      "capacity_adults": 2,
      "capacity_children": 1,
      "base_price": 110,
      "currency": "USD",
      "amenities": ["AC", "En-suite", "Moroccan tiles"],
      "inventory_count": 8,
      "is_published": true
    },
    {
      "unit_name": "Suite with Terrace",
      "unit_type": "suite",
      "capacity_adults": 2,
      "capacity_children": 0,
      "base_price": 180,
      "currency": "USD",
      "amenities": ["Private terrace", "Fireplace", "Jacuzzi bath"],
      "inventory_count": 2,
      "is_published": true
    }
  ]
}

