{
  "slug": "sahara-desert-camp",
  "name": "Sahara Desert Luxury Camp",
  "accommodation_type": "camp",
  "country_slug": "morocco",
  "destination_slug": "merzouga",
  "operator_slug": "atlas-nomad-tours",
  "summary": "Glamping in the Erg Chebbi dunes with en-suite tents and Berber music.",
  "description": "Private tents with real beds, hot shower, and traditional dinner under stars.",
  "location_label": "Merzouga, Erg Chebbi",
  "address_line_1": "Merzouga Desert, 52202",
  "latitude": 31.0926,
  "longitude": -4.0139,
  "hero_image_url": "https://images.unsplash.com/photo-1464219789935-c2b6f7ab7ecc?w=1600",
  "amenities": ["Dining tent", "Campfire", "Sunset viewing dune", "Camel parking"],
  "room_types": ["Standard Tent", "Luxury Tent"],
  "board_basis": ["Full Board", "All Inclusive (non-alcoholic)"],
 "check_in_time": "14:00",
  "check_out_time": "10:00",
  "child_policy": "Children welcome",
  "cancellation_policy": "Standard – 14 days for refund",
  "payment_policy": "50% deposit required",
  "verified_status": "verified",
  "review_count": 78,
  "average_rating": 4.9,
  "response_time_hours": 4,
  "is_featured": true,
  "is_published": true,
  "units": [
    {
      "unit_name": "Standard Desert Tent",
      "unit_type": "tent",
      "capacity_adults": 2,
      "capacity_children": 1,
      "base_price": 95,
      "currency": "USD",
      "amenities": ["Bed with linens", "Lantern", "Shared bathroom block"],
      "inventory_count": 20,
      "is_published": true
    },
    {
      "unit_name": "Luxury En-suite Tent",
      "unit_type": "tent",
      "capacity_adults": 2,
      "capacity_children": 0,
      "base_price": 165,
      "currency": "USD",
      "amenities": ["Private bathroom", "Solar powered fan", "Furnished terrace"],
      "inventory_count": 8,
      "is_published": true
    }
  ]
}
