{
  "slug": "mikumi-safari-lodge",
  "name": "Mikumi Safari Lodge",
  "accommodation_type": "tented_camp",
  "country_slug": "tanzania",
  "destination_slug": "mikumi",
  "operator_slug": "altezza-travel",
  "summary": "Safari-style Mikumi stay built for short park overnights close to game-viewing circuits.",
  "description": "Nature-focused stay near Mikumi National Park with restaurant, terrace, Wi-Fi, transfer support, and flexible safari lodging suited to quick bush extensions from Zanzibar or Dar es Salaam.",
  "location_label": "Mikumi National Park, Morogoro",
  "address_line_1": "Mikumi National Park, Morogoro, Tanzania",
  "latitude": -7.200000,
  "longitude": 37.133000,
  "hero_image_url": "https://sspark.genspark.ai/cfimages?u1=OEkD3ZlGDL7LjBg5b2l0adnLvFLodaftzj4u%2Bzhls4T8aR%2FezHFtsIwdmCJjwYGl%2FR948EEC5eOFOplBdW1v53XOMWV16mF%2FpUt9B3x9s54n1iIHwinyFzHm6VsnNidVrMs%2BEU%2BO6f8TEaBhqIzyL6Q%3D&u2=CA6lWExmHwxMBowa&width=2560",
  "amenities": ["Restaurant", "Bar", "Terrace", "Wi-Fi", "Safari Activities", "Transfers"],
  "room_types": ["Deluxe Safari Tent", "Family Safari Tent"],
  "board_basis": ["Full Board"],
  "check_in_time": "13:00",
  "check_out_time": "10:00",
  "child_policy": "Children welcome with supervision",
  "cancellation_policy": "Standard cancellation policy applies at confirmation stage",
  "payment_policy": "Deposit after availability check",
  "verified_status": "verified",
  "review_count": 0,
  "average_rating": 0.0,
  "response_time_hours": 6,
  "is_featured": false,
  "is_published": true,
  "units": [
    {
      "unit_name": "Deluxe Safari Tent",
      "unit_type": "tent",
      "capacity_adults": 2,
      "capacity_children": 1,
      "base_price": 190,
      "currency": "USD",
      "amenities": ["En-suite", "Veranda", "Mosquito Nets"],
      "inventory_count": 10,
      "is_published": true
    },
    {
      "unit_name": "Family Safari Tent",
      "unit_type": "tent",
      "capacity_adults": 4,
      "capacity_children": 2,
      "base_price": 260,
      "currency": "USD",
      "amenities": ["En-suite", "Family Layout", "Mosquito Nets"],
      "inventory_count": 6,
      "is_published": true
    }
  ]
}

